{
  "$schema": "https://json-schema.org/draft/2020-12/schema",
  "$id": "semgraph:distribution/request",
  "title": "distribution request",
  "description": "The distribution of a continuous value as bins of equal width that touch, with P25, P50 and P75, and everything above the threshold (about P95) in one open bin. The warehouse counts the bins (REQ-058); bin width and threshold are fixed per metric in the dbt YAML.",
  "type": "object",
  "additionalProperties": false,
  "required": [
    "semgraph",
    "metric",
    "binWidth",
    "bins",
    "percentiles"
  ],
  "properties": {
    "semgraph": {
      "const": "distribution"
    },
    "metric": {
      "description": "Identifier of the metric, e.g. creditLeads. Used as title when no title is given.",
      "type": "string",
      "pattern": "^[A-Za-z][A-Za-z0-9_]{0,63}$"
    },
    "title": {
      "description": "Title above the chart. States what is shown, not a conclusion.",
      "type": "string",
      "minLength": 1,
      "maxLength": 120
    },
    "binWidth": {
      "description": "The width of every bin, in the unit of the value; it stands in the reading cue.",
      "type": "number",
      "exclusiveMinimum": 0
    },
    "bins": {
      "description": "The bins from low to high, each one bin width after the previous.",
      "type": "array",
      "minItems": 2,
      "maxItems": 60,
      "items": {
        "description": "One bin: from its lower edge, one bin width wide.",
        "type": "object",
        "additionalProperties": false,
        "required": [
          "from",
          "count"
        ],
        "properties": {
          "from": {
            "description": "The lower edge of the bin.",
            "type": "number"
          },
          "count": {
            "description": "The number of units in the bin.",
            "type": "integer",
            "minimum": 0
          }
        }
      }
    },
    "openBin": {
      "description": "Everything from this threshold up, about P95: one open bin, set apart and grey.",
      "type": "object",
      "additionalProperties": false,
      "required": [
        "from",
        "count"
      ],
      "properties": {
        "from": {
          "description": "The lower edge of the bin.",
          "type": "number"
        },
        "count": {
          "description": "The number of units in the bin.",
          "type": "integer",
          "minimum": 0
        }
      }
    },
    "percentiles": {
      "description": "P25, P50 (the median) and P75 of all units, as the warehouse computed them.",
      "type": "object",
      "additionalProperties": false,
      "required": [
        "p25",
        "p50",
        "p75"
      ],
      "properties": {
        "p25": {
          "type": "number"
        },
        "p50": {
          "type": "number"
        },
        "p75": {
          "type": "number"
        }
      }
    },
    "asOf": {
      "description": "The day of the data, for the footer. Yesterday in Brussels when absent.",
      "type": "string",
      "pattern": "^[0-9]{4}-[0-9]{2}-[0-9]{2}$"
    },
    "unit": {
      "description": "The unit around every number of the metric, e.g. { \"prefix\": \"€ \" } or { \"suffix\": \" d\" }.",
      "type": "object",
      "additionalProperties": false,
      "properties": {
        "prefix": {
          "type": "string",
          "minLength": 1,
          "maxLength": 6
        },
        "suffix": {
          "type": "string",
          "minLength": 1,
          "maxLength": 6
        }
      }
    },
    "size": {
      "description": "The size of the chart (REQ-085): card (360 px wide, next to a KPI tile), default (640 px), large (1280 px, a 16:9 slide) or xl (1920 px, a big screen or print). Only the width is chosen; the height follows from the content. The chart is built anew in every size, so everything written on it fits.",
      "enum": [
        "card",
        "default",
        "large",
        "xl"
      ],
      "default": "default"
    },
    "format": {
      "description": "Output format. Only svg is available in v0.",
      "enum": [
        "svg",
        "png",
        "html",
        "widget"
      ],
      "default": "svg"
    },
    "locale": {
      "description": "Language of titles, labels and messages, e.g. en or nl-BE. Unknown locales fall back to English.",
      "type": "string",
      "pattern": "^[A-Za-z]{2,3}(-[A-Za-z0-9]{2,8})*$"
    },
    "context": {
      "description": "Provenance and status for the footer. Missing values are shown as unknown.",
      "type": "object",
      "additionalProperties": false,
      "properties": {
        "domain": {
          "type": "string",
          "minLength": 1,
          "maxLength": 80
        },
        "dataset": {
          "type": "string",
          "minLength": 1,
          "maxLength": 80
        },
        "owner": {
          "type": "string",
          "minLength": 1,
          "maxLength": 80
        },
        "reliability": {
          "type": "string",
          "minLength": 1,
          "maxLength": 80
        },
        "definitionUrl": {
          "type": "string",
          "minLength": 1,
          "maxLength": 500
        }
      }
    },
    "meta": {
      "description": "Metadata of the chart (REQ-010): the question that started it, references, the query, who asked and who built it, and the day it was compiled. Only what is given is shown (REQ-020).",
      "type": "object",
      "additionalProperties": false,
      "properties": {
        "question": {
          "description": "The question that started the chart.",
          "type": "string",
          "minLength": 1,
          "maxLength": 1000
        },
        "askedBy": {
          "description": "Who asked the question.",
          "type": "string",
          "minLength": 1,
          "maxLength": 80
        },
        "builtBy": {
          "description": "Who built the chart.",
          "type": "string",
          "minLength": 1,
          "maxLength": 80
        },
        "references": {
          "description": "Links to Jira, Slack or anything else.",
          "type": "array",
          "minItems": 1,
          "maxItems": 10,
          "items": {
            "type": "object",
            "additionalProperties": false,
            "required": [
              "url"
            ],
            "properties": {
              "label": {
                "type": "string",
                "minLength": 1,
                "maxLength": 120
              },
              "url": {
                "type": "string",
                "minLength": 1,
                "maxLength": 500
              }
            }
          }
        },
        "query": {
          "description": "The query behind the data, shown as written.",
          "type": "string",
          "minLength": 1,
          "maxLength": 10000
        },
        "compiledOn": {
          "description": "The day the chart was compiled. When absent, the day it is drawn, in Brussels.",
          "type": "string",
          "pattern": "^[0-9]{4}-[0-9]{2}-[0-9]{2}$"
        }
      }
    }
  }
}
